{
  "schema_version": "funding-story-template-v1",
  "id": "t04_full_campaign",
  "template_name": "로봇청소기 전체 캠페인형",
  "category": "테크·가전",
  "language": "ko",
  "generation_source": "research-derived",
  "target": "핵심 성능부터 문제·해결·비교·신뢰·프로젝트 운영 정보까지 한 번에 검토하려는 로봇청소기 관심 사용자",
  "default_word_count": 2200,
  "narration_mode": "performance_problem_solution_full_campaign",
  "style": {
    "tone_keywords": ["실용적", "구체적", "검토가능"],
    "sentence_style": "핵심 성능을 먼저 제시하고 문제·해결·비교·운영 정보를 짧은 문단과 구조화 블록으로 연결",
    "visual_mood": "밝은 제품 사진과 민트 계열 강조를 사용하는 테크 가전 캠페인 구성",
    "color_palette": ["#0F172A", "#2DD4BF", "#F8FAFC"],
    "font_style": "Sans-serif",
    "typography": "제목은 굵게, 제공된 성능 수치는 조건과 함께 강조하고 미확인 정보는 중립적으로 표시",
    "urgency_style": "입력된 수량·기간·일정이 없으면 긴급성이나 예정일을 만들지 않음",
    "cta_style": "확인된 제품 특성과 미확인 프로젝트 정보를 구분한 뒤 검토와 참여를 안내"
  },
  "content_strategy": {
    "core_message": "제품의 핵심 성능과 자동화 범위를 문제·해결 구조로 설명하고 비교·신뢰·프로젝트 정보를 편집 가능한 전체 캠페인 골격에 배치한다.",
    "product_keywords": ["로봇청소기", "도킹스테이션", "올인원"],
    "success_metrics": ["전체 캠페인 섹션 역할·순서 유지", "입력된 사실과 미확인 정보 분리", "표·목록·강조·이미지의 편집 가능성"],
    "emphasis_phrases": {
      "performance": ["수치와 시험 조건을 같은 블록에 배치", "입력된 기능만 강조"],
      "problem_solution": ["입력된 타깃과 기능만 연결", "효과를 절대적으로 단정하지 않음"],
      "trust": ["자체 시험과 외부 인증을 구분", "후기·경력·인증은 근거가 있을 때만 사용"],
      "project": ["구성·사용계획·일정·리스크는 입력값만 사용", "미입력 항목은 추정하지 않음"]
    }
  },
  "layout": [
    {
      "id": "hero",
      "label": "히어로",
      "type": "intro",
      "summary": "대표 성능과 제품 정체성을 첫 화면에서 제시",
      "expected_content": "제품명, 제품 유형, 대표 성능·조건, 핵심 기능과 타깃을 입력 사실로 요약",
      "visual_hint": "참조 제품 본체와 도크를 유지한 밝은 가로 제품 사진과 편집 가능한 제목 여백",
      "content_type": "image_full_overlay",
      "image_required": true,
      "overlay_content": "{{headline}} · {{verified_performance}}",
      "html_content": "<section class=\"hero\"><h1>{{headline}}</h1><p>{{verified_summary}}</p><ul>{{key_features}}</ul></section>",
      "html_structure": "full-width hero followed by verified feature list"
    },
    {
      "id": "problem",
      "label": "문제 제기",
      "type": "problem",
      "summary": "타깃이 해결하려는 청소 부담을 입력 범위 안에서 정의",
      "expected_content": "AUDIENCE와 명시된 PROBLEM만 사용하며 시장 전체나 위생 효과를 일반화하지 않음",
      "visual_hint": "문제별 짧은 목록과 충분한 여백. 미제공 불편은 만들지 않음",
      "content_type": "problem_list",
      "image_required": false,
      "overlay_content": null,
      "html_content": "<section class=\"problem\"><h2>{{problem_heading}}</h2><ul>{{supported_problem_items}}</ul></section>",
      "html_structure": "problem heading with evidence-bounded list"
    },
    {
      "id": "solution",
      "label": "솔루션",
      "type": "solution",
      "summary": "확인된 기능을 타깃의 요구와 연결",
      "expected_content": "FEATURE·FACT·CLAIM ID를 사용해 청소·물걸레·센서·도크 기능과 조건을 설명하고 미검증 효과는 제외",
      "visual_hint": "참조 제품 외형만 유지한 실제 사용 공간의 가로 이미지와 편집 가능한 본문 여백",
      "content_type": "image_solution_list",
      "image_required": true,
      "overlay_content": "{{solution_heading}}",
      "html_content": "<section class=\"solution\"><h2>{{solution_heading}}</h2><p>{{solution_summary}}</p><ul>{{verified_solution_items}}</ul></section>",
      "html_structure": "solution image followed by verified feature list"
    },
    {
      "id": "comparison",
      "label": "비교",
      "type": "comparison",
      "summary": "검증 가능한 비교 근거만 표로 제공",
      "expected_content": "비교 제품·시장 데이터가 없으면 자사 입력 사실만 정리하고 일반 제품 수치·우열을 생성하지 않음",
      "visual_hint": "출처가 있는 항목만 포함한 편집 가능한 비교 표",
      "content_type": "comparison_table",
      "image_required": false,
      "overlay_content": null,
      "html_content": "<section class=\"comparison\"><h2>{{comparison_heading}}</h2><table>{{supported_comparison_rows}}</table></section>",
      "html_structure": "source-bounded comparison table"
    },
    {
      "id": "features",
      "label": "주요 기능·구성",
      "type": "feature",
      "summary": "주요 기능과 확인된 구성만 정리",
      "expected_content": "FEATURE와 FACT를 표·목록으로 정리하고 리워드 구성품이 없으면 미입력 사실을 표시",
      "visual_hint": "추가 구성품 없이 참조 제품 본체와 도크만 보여 주는 가로 제품 이미지",
      "content_type": "image_feature_table",
      "image_required": true,
      "overlay_content": "{{features_heading}}",
      "html_content": "<section class=\"features\"><h2>{{features_heading}}</h2><table>{{verified_feature_rows}}</table></section>",
      "html_structure": "feature image followed by editable feature table"
    },
    {
      "id": "social_proof",
      "label": "신뢰·검증",
      "type": "evidence",
      "summary": "시험·인증·후기·메이커 배경을 출처 상태와 함께 구분",
      "expected_content": "EVIDENCE와 CLAIM을 연결하고 인증·전문가 평가·후기가 없으면 생성하지 않음",
      "visual_hint": "증빙 유형과 적용 범위를 나타내는 편집 가능한 목록",
      "content_type": "evidence_list",
      "image_required": false,
      "overlay_content": null,
      "html_content": "<section class=\"evidence\"><h2>{{trust_heading}}</h2><ul>{{evidence_items}}</ul></section>",
      "html_structure": "evidence list without fabricated quotation"
    },
    {
      "id": "funding_plan",
      "label": "펀딩금 사용 계획",
      "type": "funding_plan",
      "summary": "메이커가 제공한 펀딩금 사용 항목·비율을 표로 제시",
      "expected_content": "사용 계획 입력이 없으면 비율과 용도를 만들지 않고 필요한 입력 항목만 표시",
      "visual_hint": "제공된 값만 포함하는 편집 가능한 사용 계획 표",
      "content_type": "funding_plan_table",
      "image_required": false,
      "overlay_content": null,
      "html_content": "<section class=\"funding-plan\"><h2>{{funding_heading}}</h2><table>{{provided_funding_rows}}</table></section>",
      "html_structure": "funding plan table or missing-input notice"
    },
    {
      "id": "platform_choice",
      "label": "플랫폼 선택 이유",
      "type": "platform_choice",
      "summary": "메이커가 제공한 펀딩 플랫폼 선택 이유를 설명",
      "expected_content": "선택 이유가 입력되지 않았으면 메이커 의도·성과·커뮤니티 효과를 추정하지 않음",
      "visual_hint": "제공된 선택 이유를 짧은 목록으로 배치",
      "content_type": "platform_reason_list",
      "image_required": false,
      "overlay_content": null,
      "html_content": "<section class=\"platform-choice\"><h2>{{platform_heading}}</h2><ul>{{provided_reasons}}</ul></section>",
      "html_structure": "maker-provided platform reason list"
    },
    {
      "id": "timeline",
      "label": "개발·생산 일정",
      "type": "timeline",
      "summary": "개발·생산·발송 일정을 입력값으로만 구성",
      "expected_content": "SCHEDULE_POLICY와 일정 출처를 사용하고 미입력 기간·미래 공지 약속을 만들지 않음",
      "visual_hint": "날짜와 상태를 수정할 수 있는 세로 타임라인",
      "content_type": "project_timeline",
      "image_required": false,
      "overlay_content": null,
      "html_content": "<section class=\"timeline\"><h2>{{timeline_heading}}</h2><ol>{{provided_schedule}}</ol></section>",
      "html_structure": "editable schedule timeline or missing-input notice"
    },
    {
      "id": "team",
      "label": "메이커·팀",
      "type": "team",
      "summary": "제공된 팀 규모·경험·개발 기간을 역할별 추정 없이 소개",
      "expected_content": "CLAIM과 FACT로 확인된 팀 정보만 사용하고 개인별 경력·직책은 입력이 있을 때만 표시",
      "visual_hint": "검증된 팀 정보와 미입력 역할을 구분한 목록",
      "content_type": "team_list",
      "image_required": false,
      "overlay_content": null,
      "html_content": "<section class=\"team\"><h2>{{team_heading}}</h2><ul>{{verified_team_items}}</ul></section>",
      "html_structure": "team fact list without inferred roles"
    },
    {
      "id": "risks",
      "label": "리스크·대응",
      "type": "risk",
      "summary": "메이커가 제공한 공급·생산·일정 리스크와 대응만 정리",
      "expected_content": "대응 계획이 없으면 공급업체·QA 조직·업데이트 약속을 만들지 않고 미입력 사실을 표시",
      "visual_hint": "리스크와 대응을 분리한 편집 가능한 목록 또는 표",
      "content_type": "risk_table",
      "image_required": false,
      "overlay_content": null,
      "html_content": "<section class=\"risks\"><h2>{{risk_heading}}</h2><table>{{provided_risk_rows}}</table></section>",
      "html_structure": "risk-response table or missing-input notice"
    },
    {
      "id": "cta",
      "label": "참여 안내",
      "type": "cta",
      "summary": "확인된 제품 가치와 검토 필요 정보를 바탕으로 참여를 안내",
      "expected_content": "검증된 기능을 짧게 요약하고 미제공 가격·수량·마감 긴급성을 만들지 않음",
      "visual_hint": "제품 핵심 가치와 검토 안내를 담는 단순한 마무리 배너",
      "content_type": "cta_banner",
      "image_required": false,
      "overlay_content": null,
      "html_content": "<section class=\"cta\"><h2>{{cta_heading}}</h2><p>{{verified_cta}}</p></section>",
      "html_structure": "verified-value CTA without artificial urgency"
    }
  ]
}
