{
  "schema_version": "funding-story-template-v1",
  "id": "t02_problem_solution_automation",
  "template_name": "로봇청소기 문제–해결·완전자동형",
  "category": "테크·가전",
  "language": "ko",
  "generation_source": "manual-analysis",
  "target": "청소 과정의 반복 작업과 관리 부담을 줄이는 자동화 기능을 우선하는 사용자",
  "default_word_count": 2000,
  "narration_mode": "problem_solution",
  "style": {
    "tone_keywords": ["문제해결", "구체적", "신뢰감"],
    "sentence_style": "문제 하나와 대응 기능 하나를 짝지어 전후 관계를 명확히 설명",
    "visual_mood": "청소 전 과정을 단계별로 보여주는 자동화 흐름 중심 구성",
    "color_palette": ["#0F172A", "#0EA5E9", "#F97316"],
    "font_style": "Sans-serif",
    "typography": "문제는 중간 크기, 해결 결과와 자동화 단계는 굵은 제목으로 표현",
    "urgency_style": "개발 예정 기능과 현재 제공 기능을 분리하고 예정일은 입력이 있을 때만 표시",
    "cta_style": "자동화 범위와 예외 조건을 확인한 후 적합한 리워드를 선택하도록 안내"
  },
  "content_strategy": {
    "core_message": "사용자가 겪는 복수의 청소 문제를 정의하고 각 문제를 해결하는 자동화 기능·작동 조건·예외를 연결한다.",
    "product_keywords": ["로봇청소기", "완전자동", "자동세척", "자동비움", "앱제어", "AS"],
    "success_metrics": ["문제와 기능의 1:1 연결", "자동화 범위·예외 표시", "예정 기능과 제공 기능 분리"],
    "emphasis_phrases": {
      "problem": ["사용 상황을 특정", "확인된 불편만 사용"],
      "solution": ["대응 기능과 조건 연결", "예외와 수동 작업 공개"],
      "service": ["AS 범위와 기간 명시", "입력된 서비스 정보만 사용"]
    }
  },
  "layout": [
    {
      "id": "hero",
      "label": "자동화 약속",
      "type": "intro",
      "summary": "제품이 자동화하는 청소 범위를 한 문장과 흐름으로 제시",
      "expected_content": "제품명, 자동화 대상 단계, 대표 편익, 현재 제공 여부와 관련 FEATURE ID",
      "visual_hint": "제품과 스테이션 전체 이미지 위에 자동화 단계 아이콘 배치",
      "content_type": "image_full_overlay",
      "image_required": true,
      "overlay_content": "{{automation_promise}}",
      "html_content": "<section class=\"hero\"><h1>{{headline}}</h1><p>{{automation_scope}}</p></section>",
      "html_structure": "full-width hero with automation flow"
    },
    {
      "id": "problem_matrix",
      "label": "문제 목록",
      "type": "problem",
      "summary": "가격·관리·공간·서비스 등 입력된 문제를 분리",
      "expected_content": "PROBLEM ID별 사용 상황, 영향, 빈도. 입력에 없는 시장 일반화는 제외",
      "visual_hint": "문제별 카드와 사용 장면 이미지",
      "content_type": "problem_cards",
      "image_required": false,
      "overlay_content": null,
      "html_content": "<section class=\"problems\"><h2>{{problem_heading}}</h2><div>{{problem_cards}}</div></section>",
      "html_structure": "problem card grid"
    },
    {
      "id": "solution_map",
      "label": "문제–해결 연결",
      "type": "solution",
      "summary": "각 문제에 대응하는 기능과 남는 제약을 매핑",
      "expected_content": "PROBLEM ID, FEATURE ID, CLAIM·EVIDENCE ID와 해결되지 않는 예외 조건",
      "visual_hint": "문제 → 기능 → 결과 → 예외의 가로 흐름",
      "content_type": "mapping_flow",
      "image_required": false,
      "overlay_content": null,
      "html_content": "<section class=\"solution-map\"><h2>{{solution_heading}}</h2><div>{{problem_solution_pairs}}</div></section>",
      "html_structure": "repeated problem-to-solution rows"
    },
    {
      "id": "automation_journey",
      "label": "자동화 여정",
      "type": "mechanism",
      "summary": "청소 시작부터 관리까지 자동·수동 단계를 구분",
      "expected_content": "시작, 청소, 복귀, 비움·세척·건조·급배수 중 실제 지원 단계와 조건",
      "visual_hint": "단계별 타임라인. 자동은 강조색, 수동 또는 미지원은 중립색",
      "content_type": "process_timeline",
      "image_required": true,
      "overlay_content": "{{supported_automation_steps}}",
      "html_content": "<section class=\"journey\"><h2>{{journey_heading}}</h2><ol>{{automation_steps}}</ol></section>",
      "html_structure": "horizontal automation timeline"
    },
    {
      "id": "control_privacy",
      "label": "제어·프라이버시",
      "type": "detail",
      "summary": "앱·카메라·원격 제어 기능의 설정과 데이터 조건 설명",
      "expected_content": "앱 지원 OS·연결 조건·권한·저장 여부와 입력된 프라이버시 안내",
      "visual_hint": "앱 화면과 설정 단계. 데이터 저장 주장은 정책 근거가 있을 때만 포함",
      "content_type": "app_step_guide",
      "image_required": false,
      "overlay_content": null,
      "html_content": "<section class=\"control\"><h2>{{control_heading}}</h2><ol>{{control_steps}}</ol><aside>{{privacy_conditions}}</aside></section>",
      "html_structure": "app guide with privacy note"
    },
    {
      "id": "performance_proof",
      "label": "청소 성능 증빙",
      "type": "evidence",
      "summary": "자동화 외 기본 청소 성능을 조건·증빙과 함께 제시",
      "expected_content": "흡입·물걸레·센서·장애물 회피 등 FEATURE·FACT·EVIDENCE ID와 시험 조건",
      "visual_hint": "기능 데모와 시험 조건을 나란히 배치",
      "content_type": "evidence_comparison",
      "image_required": true,
      "overlay_content": "{{verified_performance}}",
      "html_content": "<section class=\"performance\"><h2>{{performance_heading}}</h2><div>{{evidence_blocks}}</div></section>",
      "html_structure": "evidence blocks with conditions"
    },
    {
      "id": "service",
      "label": "설치·AS",
      "type": "trust",
      "summary": "설치 지원과 사후 서비스의 범위·기간·예외 설명",
      "expected_content": "설치 대상 지역, 비용, AS 기간·주체·절차, 제외 조건과 출처",
      "visual_hint": "서비스 흐름과 문의 경로를 표로 표현",
      "content_type": "service_table",
      "image_required": false,
      "overlay_content": null,
      "html_content": "<section class=\"service\"><h2>{{service_heading}}</h2><dl>{{service_details}}</dl></section>",
      "html_structure": "service definition list"
    },
    {
      "id": "maker_story",
      "label": "메이커의 문제 해결 과정",
      "type": "maker",
      "summary": "개발 동기와 해결 과정에서 확인 가능한 사실을 기록",
      "expected_content": "메이커 배경, 문제 발견 경로, 개발·검증 단계, 팀 역량과 출처",
      "visual_hint": "팀·개발 과정 이미지와 날짜가 있는 마일스톤",
      "content_type": "maker_timeline",
      "image_required": false,
      "overlay_content": null,
      "html_content": "<section class=\"maker\"><h2>{{maker_heading}}</h2><ol>{{maker_milestones}}</ol></section>",
      "html_structure": "maker narrative timeline"
    },
    {
      "id": "reward",
      "label": "리워드",
      "type": "reward",
      "summary": "본체·스테이션·옵션·설치 구성과 가격을 구분",
      "expected_content": "REWARD ID별 구성품, 가격, 수량, 옵션, 배송 차수. 누락값은 미입력",
      "visual_hint": "구성품 사진과 가격·옵션 표",
      "content_type": "reward_cards",
      "image_required": false,
      "overlay_content": null,
      "html_content": "<section class=\"rewards\"><h2>{{reward_heading}}</h2><div>{{reward_cards}}</div></section>",
      "html_structure": "repeatable reward cards"
    },
    {
      "id": "project_detail",
      "label": "일정·정책",
      "type": "policy",
      "summary": "개발 예정 기능과 배송·환불·AS 일정을 분리",
      "expected_content": "현재 기능, 예정 기능, 개발·발송 일정, 환불·AS 정책과 UNKNOWN 목록",
      "visual_hint": "상태 라벨이 있는 일정표와 정책 표",
      "content_type": "status_timeline",
      "image_required": false,
      "overlay_content": null,
      "html_content": "<section class=\"project-detail\"><h2>{{detail_heading}}</h2><div>{{status_timeline}}</div><dl>{{policy_details}}</dl></section>",
      "html_structure": "status timeline followed by policy list"
    }
  ]
}
